{
  "$schema": "https://json-schema.org/draft/2020-12/schema",
  "$id": "https://webrtc-minimize.local/schemas/todo.schema.json",
  "title": "WebRTC Minimize Category Todo Schema",
  "type": "object",
  "additionalProperties": true,
  "required": ["version", "created", "updated", "project", "review_basis", "categories", "meta"],
  "properties": {
    "$schema": { "type": "string" },
    "version": { "anyOf": [{ "type": "integer" }, { "type": "string", "minLength": 1 }] },
    "created": { "type": "string", "minLength": 1 },
    "updated": { "type": "string", "minLength": 1 },
    "project": { "type": "string", "minLength": 1 },
    "review_basis": {
      "type": "object",
      "additionalProperties": true,
      "required": ["reviewed_commit_range", "review_goal"],
      "properties": {
        "reviewed_commit_range": { "type": "string", "minLength": 1 },
        "review_goal": { "type": "string", "minLength": 1 }
      }
    },
    "categories": {
      "type": "array",
      "items": {
        "type": "object",
        "additionalProperties": true,
        "required": ["name", "label", "items"],
        "properties": {
          "name": { "type": "string", "minLength": 1 },
          "label": { "type": "string", "minLength": 1 },
          "items": {
            "type": "array",
            "items": {
              "type": "object",
              "additionalProperties": true,
              "required": ["id", "title", "status", "priority"],
              "properties": {
                "id": { "type": "string", "minLength": 1 },
                "title": { "type": "string", "minLength": 1 },
                "status": { "enum": ["open", "partial", "completed", "deferred", "blocked"] },
                "priority": { "enum": ["P0", "P1", "P2", "P3"] }
              }
            }
          }
        }
      }
    },
    "meta": {
      "type": "object",
      "additionalProperties": true,
      "required": ["total_items", "by_status", "notes", "recommended_order"],
      "properties": {
        "total_items": { "type": "integer", "minimum": 0 },
        "by_status": {
          "type": "object",
          "additionalProperties": true,
          "required": ["completed", "partial", "open"],
          "properties": {
            "completed": { "type": "integer", "minimum": 0 },
            "partial": { "type": "integer", "minimum": 0 },
            "open": { "type": "integer", "minimum": 0 }
          }
        },
        "notes": { "type": "array", "items": { "type": "string" } },
        "recommended_order": { "type": "array", "items": { "type": "string", "minLength": 1 } }
      }
    }
  }
}
