{
  "$schema": "../todo.schema.json",
  "version": 1,
  "created": "2026-08-27",
  "updated": "2026-09-11",
  "project": "webrtc-minimize-server",
  "review_basis": {
    "reviewed_commit_range": "workspace snapshot of /home/krusty/ananta on 2026-08-27",
    "review_goal": "Alle relevanten Ananta-Ideen für WebRTC Audio, Video, Bildschirm, DataChannel, Rendezvous, E2EE, Mesh, SFU und Betrieb in einen priorisierten Projekt-Backlog überführen."
  },
  "categories": [
    {
      "name": "identity_security",
      "label": "Identität und E2EE",
      "items": [
        { "id": "PROD-SEC-001", "title": "OIDC-Identität, Geräteschlüssel und zeitlich begrenzte Invite-Grants einführen", "status": "partial", "priority": "P0" },
        { "id": "PROD-SEC-002", "title": "Signierte Membership-, Medienvertrag- und Security-Epochen modellieren", "status": "partial", "priority": "P0" },
        { "id": "PROD-SEC-003", "title": "Browser-Encoded-Transform/SFrame-E2EE mit Downgrade-Schutz evaluieren und implementieren", "status": "completed", "priority": "P0" },
        { "id": "PROD-SEC-004", "title": "Replay-Fenster, Senderauthentizität, Key-Rotation und Revocation härten", "status": "partial", "priority": "P0" }
      ]
    },
    {
      "name": "network_topology",
      "label": "Netz und Topologien",
      "items": [
        { "id": "PROD-NET-001", "title": "Kurzlebige TURN-Credentials, Allowlist, Quotas und IP-Privacy integrieren", "status": "partial", "priority": "P0" },
        { "id": "PROD-NET-002", "title": "Ressourcenadaptive Mesh-Grenze mit Browser-Stats, Hysterese und Degradation ableiten", "status": "completed", "priority": "P1" },
        { "id": "PROD-NET-003", "title": "SFU-Fallback für größere Räume mit E2EE-, Admission- und Layer-Policy anbinden", "status": "open", "priority": "P1" },
        { "id": "PROD-NET-004", "title": "Verschlüsselten publikationsbezogenen Peer-DAG nur hinter Machbarkeits- und Security-Gates erproben", "status": "partial", "priority": "P2" }
      ]
    },
    {
      "name": "collaboration_data",
      "label": "Kollaboration und Daten",
      "items": [
        { "id": "PROD-DATA-001", "title": "Versionierte Traffic-Klassen, Prioritätsqueue und Backpressure für Control, Chat und Bulk definieren", "status": "completed", "priority": "P1" },
        { "id": "PROD-DATA-002", "title": "Verschlüsselten, gehashten und fortsetzbaren Artefakttransfer über DataChannel bauen", "status": "completed", "priority": "P1" },
        { "id": "PROD-DATA-003", "title": "Persistente Workspace-, Presence-, Thread-, Cursor- und Replay-Verträge ergänzen", "status": "partial", "priority": "P2" }
      ]
    },
    {
      "name": "operations_quality",
      "label": "Betrieb und Qualität",
      "items": [
        { "id": "PROD-OPS-001", "title": "Inhaltsfreie WebRTC-/TURN-Observability, SLOs und Abuse-Rate-Limits einführen", "status": "partial", "priority": "P0" },
        { "id": "PROD-OPS-002", "title": "Chromium-, Firefox- und WebKit-Matrix einschließlich NAT-, Netzwechsel- und Churn-Gates automatisieren", "status": "partial", "priority": "P0" },
        { "id": "PROD-OPS-003", "title": "Accessibility-, Consent-, Device-Wechsel- und Berechtigungsdiagnose härten", "status": "open", "priority": "P1" },
        { "id": "PROD-OPS-004", "title": "Feature-Flags, Canary, Rollback und sichere Konfigurationsprofile etablieren", "status": "open", "priority": "P1" }
      ]
    }
  ],
  "meta": {
    "total_items": 15,
    "by_status": { "completed": 4, "partial": 8, "open": 3 },
    "notes": [
      "Diese Category-Todo ist Portfolio/Research, kein ausführbarer Task-Track.",
      "Neue Implementierung beginnt erst nach Promotion eines Items in todos/active/todo.<track>.json.",
      "PROD-SEC-001 bleibt partial: OIDC, P-256-Gerätebindung und Einmal-Tickets sind vorhanden; langlebige zeitbegrenzte Invite-Grants und Gerätewiderruf fehlen.",
      "PROD-SEC-003 ist abgeschlossen: RFC-9605-SFrame AES_128_GCM_SHA256_128, Encoded-Transform-Worker, quittierte publikations-/Zielpeer-/Membership-Epoch-Keys, Replay-Schutz und required-Downgrade-Schutz sind mit offiziellen Vektoren sowie Chromium/Firefox belegt.",
      "PROD-SEC-004 bleibt partial: Frame-Replay-Fenster, Epoch-Rotation und Cleanup sind vorhanden; vom Signaling unabhängige Senderauthentizität, Gerätewiderruf und MLS-artige Gruppenschlüssel fehlen.",
      "PROD-NET-001 bleibt partial: kurzlebige Coturn-/Edge-REST-Credentials, Private-Network-Policy und Allocation-Quoten sind vorhanden; Edge-TURN/TLS, Secret-Rotation, umfassende IP-Privacy und Multi-Region-Failover fehlen.",
      "PROD-NET-002 ist abgeschlossen: Active-Speaker-Profile, Stats-Hysterese, per-Peer-Senderstufen, Mosaik, Churn-Fallback und Trusted-Relay-Fanout sind in Chromium/Firefox-Gates belegt.",
      "PROD-NET-004 ist in todos/active/todo.blind-media-edge-agents.json promoviert: Browser-Cross-PeerConnection-Fanout bleibt standardseitig no-go; ein separater nativer SFrame-blinder Agent mit Creator-Praeferenz, Consent, Leases, Failover, Publisher-Sharding und TURN-Fallback ist lokal default-off implementiert, sein realer Produktionsgate bleibt offen.",
      "PROD-DATA-001/002 sind abgeschlossen: der browserseitige Overlay besitzt Traffic-Class-Caps, ECDH/AES-GCM, Digest, Replay-/TTL-/Hop-Grenzen, Chunk-ACK/Resume und expliziten Download.",
      "PROD-DATA-003 bleibt partial: Workspace, Presence und Cursor sind persistent; Threads, HA sowie Backup/Restore fehlen.",
      "SFU bleibt ein optionaler Skalierungs-Folgeschritt; required-SFrame arbeitet als adaptives Direct-/Edge-/Infrastruktur-TURN-Mesh, während der consentierte Decode/Re-encode-Trusted-Relay nur im expliziten disabled-Legacy-Modus aktiv ist.",
      "PROD-OPS-001 ist in todos/active/todo.meet-observability.json promoviert: inhaltsfreie Join-/Session-/Rate-Limit-/TURN-Zähler sind lokal; Collector, SLOs und Browser-Gates bleiben MEET-OPS-002."
    ],
    "recommended_order": ["PROD-SEC-001", "PROD-SEC-002", "PROD-NET-001", "PROD-SEC-003", "PROD-SEC-004", "PROD-OPS-001", "PROD-NET-002", "PROD-DATA-001", "PROD-DATA-002", "PROD-NET-003", "PROD-OPS-003", "PROD-OPS-004", "PROD-DATA-003", "PROD-NET-004", "PROD-OPS-002"]
  }
}
